Feature ID,Role,Module,Feature Name,Description,Priority,Effort,Static Feature,Dynamic Feature,Fully Tested,Timeline,Status,Notes
AUTH-001,Customer,Authentication,Splash Screen,App launch screen with branding and logo,P0,S,✓,,,,Completed,UI implemented with gradient background
AUTH-002,Customer,Authentication,Onboarding Screen,3-slide carousel showcasing app features,P0,S,✓,,,,Completed,Interactive carousel with skip option
AUTH-003,Customer,Authentication,Phone Login Screen,Phone number input with +91 country code,P0,S,✓,,,,Completed,Form validation implemented
AUTH-004,Customer,Authentication,OTP Verification Screen,6-digit OTP input with auto-verification,P0,M,✓,,,,Completed,OTP input with resend functionality
AUTH-005,Customer,Authentication,Profile Setup Screen,Initial profile creation with name and photo,P0,M,✓,,,,Completed,Image picker integrated
AUTH-006,Customer,Authentication,City Selection Screen,City selection from available cities,P0,S,✓,,,,Completed,7 cities with visual cards
AUTH-007,Customer,Authentication,Email/Password Login,Alternative login method,P1,M,,,,"Q2 2026",Planned,Backend integration required
AUTH-008,Customer,Authentication,Google Sign-In,Social authentication via Google,P1,M,,,,"Q2 2026",Planned,Firebase Auth integration needed
AUTH-009,Customer,Authentication,Facebook Sign-In,Social authentication via Facebook,P1,M,,,,"Q2 2026",Planned,Firebase Auth integration needed
AUTH-010,Customer,Authentication,Session Management,Auto-login and session persistence,P0,M,✓,,,,Completed,SharedPreferences implementation
HOME-001,Customer,Home Dashboard,Home Screen,Main dashboard with personalized greeting,P0,L,✓,,,,Completed,Full UI with all sections
HOME-002,Customer,Home Dashboard,Location Selector,City dropdown with saved preferences,P0,S,✓,,,,Completed,7 cities available
HOME-003,Customer,Home Dashboard,Quick Action Buttons,Book Event My Events My Reels Refer Earn buttons,P0,S,✓,,,,Completed,4 action buttons implemented
HOME-004,Customer,Home Dashboard,Event Category Carousel,5 event types with horizontal scroll,P0,M,✓,,,,Completed,Wedding Birthday Engagement Corporate Brand
HOME-005,Customer,Home Dashboard,Trending Reels Section,Showcase of popular reels,P0,M,✓,,,,Completed,Mock data with images
HOME-006,Customer,Home Dashboard,Featured Providers,Top-rated providers showcase,P0,M,✓,,,,Completed,Provider cards with ratings
HOME-007,Customer,Home Dashboard,Promotional Banners,Carousel with promotional offers,P1,S,✓,,,,Completed,Auto-playing carousel
HOME-008,Customer,Home Dashboard,Package Highlights,Featured package information,P1,S,✓,,,,Completed,Gold package highlighted
HOME-009,Customer,Home Dashboard,Bottom Navigation,Main navigation bar with 4 tabs,P0,M,✓,,,,Completed,Home Discover Reels Profile
HOME-010,Customer,Home Dashboard,Schedule Packages Screen,Pre-book packages for future dates,P1,M,✓,,,,Completed,Calendar integration
BOOK-001,Customer,Event Booking,Event Type Selection,Choose from 5 event types,P0,M,✓,,,,Completed,Wedding Birthday Engagement Corporate Brand
BOOK-002,Customer,Event Booking,Package Selection,Compare Bronze Silver Gold Platinum packages,P0,L,✓,,,,Completed,Detailed package comparison
BOOK-003,Customer,Event Booking,Event Details Form,Enter event name date time duration guest count,P0,L,✓,,,,Completed,Form validation implemented
BOOK-004,Customer,Event Booking,Venue Selection,Select or add venue with map integration,P0,M,✓,,,,Completed,Google Maps integration ready
BOOK-005,Customer,Event Booking,Provider Selection,Browse and filter service providers,P0,L,✓,,,,Completed,Provider list with filters
BOOK-006,Customer,Event Booking,Provider Portfolio,View provider details portfolio and ratings,P0,M,✓,,,,Completed,Portfolio gallery view
BOOK-007,Customer,Event Booking,Package Customization,Add extras and customize package,P0,M,✓,,,,Completed,Add-ons selection
BOOK-008,Customer,Event Booking,Booking Summary,Review booking details before payment,P0,M,✓,,,,Completed,Complete booking overview
BOOK-009,Customer,Event Booking,Payment Integration,Razorpay payment gateway integration,P0,L,✓,,,,"Q2 2026",In Progress,UI ready backend integration pending
BOOK-010,Customer,Event Booking,Booking Confirmation,Post-payment confirmation screen,P0,S,✓,,,,Completed,Confirmation with booking ID
BOOK-011,Customer,Event Booking,Auto Provider Assignment,Automatic provider matching algorithm,P1,M,,,,"Q3 2026",Planned,Backend algorithm needed
BOOK-012,Customer,Event Booking,Booking Reschedule,Reschedule existing bookings,P1,M,,,,"Q3 2026",Planned,Backend integration required
BOOK-013,Customer,Event Booking,Booking Cancellation,Cancel bookings with refund policy,P1,M,,,,"Q3 2026",Planned,Refund logic needed
EVENT-001,Customer,My Events,My Events Screen,List all events with tabs Upcoming Ongoing Past,P0,L,✓,,,,Completed,3 tabs with filtering
EVENT-002,Customer,My Events,Event Details Screen,Detailed event information view,P0,M,✓,,,,Completed,Complete event information
EVENT-003,Customer,My Events,Live Event Tracking,Real-time event coverage tracking,P0,L,✓,,,,"Q2 2026",In Progress,UI ready real-time updates pending
EVENT-004,Customer,My Events,Provider Contact,Contact provider during event,P0,S,✓,,,,Completed,Call and message buttons
EVENT-005,Customer,My Events,Event Timeline,Visual timeline of event milestones,P1,M,✓,,,,Completed,Timeline with key moments
EVENT-006,Customer,My Events,Reel Delivery Notifications,Push notifications for new reels,P0,M,,,,"Q2 2026",Planned,FCM integration needed
EVENT-007,Customer,My Events,Event Completion Status,Track event completion and deliverables,P0,M,,,,"Q2 2026",Planned,Backend status tracking
REEL-001,Customer,Reels Gallery,My Reels Gallery,Grid and list view of all user reels,P0,L,✓,,,,Completed,Grid/List toggle implemented
REEL-002,Customer,Reels Gallery,Reel Filtering,Filter reels by event type,P0,M,✓,,,,Completed,5 event type filters
REEL-003,Customer,Reels Gallery,Reel Sorting,Sort by recent popular views,P0,S,✓,,,,Completed,3 sort options
REEL-004,Customer,Reels Gallery,Reel Search,Search reels by keywords,P1,M,✓,,,,Completed,Search functionality
REEL-005,Customer,Reels Gallery,Reel Player,Full-screen video player with controls,P0,L,✓,,,,"Q2 2026",In Progress,UI ready video playback pending
REEL-006,Customer,Reels Gallery,Reel Share,Share to Instagram WhatsApp Facebook TikTok,P0,M,✓,,,,"Q2 2026",In Progress,Share UI ready native sharing pending
REEL-007,Customer,Reels Gallery,Reel Download,Download reels to device,P1,M,,,,"Q2 2026",Planned,Storage permission needed
REEL-008,Customer,Reels Gallery,Reel Analytics,Views shares likes engagement metrics,P1,M,,,,"Q3 2026",Planned,Analytics backend needed
REEL-009,Customer,Reels Gallery,Organize by Event,Group reels by event,P0,M,✓,,,,Completed,Event-based organization
DISC-001,Customer,Discover Feed,Discover Feed Screen,TikTok-style vertical scrolling feed,P0,L,✓,,,,Completed,Full-screen vertical feed
DISC-002,Customer,Discover Feed,Trending Reels Screen,Curated trending content,P0,M,✓,,,,Completed,Trending section with filters
DISC-003,Customer,Discover Feed,Auto-Play Videos,Automatic video playback on scroll,P0,M,✓,,,,"Q2 2026",In Progress,Video player integration needed
DISC-004,Customer,Discover Feed,Filter by Event Type,Filter feed by event type,P0,S,✓,,,,Completed,5 event type filters
DISC-005,Customer,Discover Feed,Filter by Editing Style,Filter by editing style,P1,M,✓,,,,Completed,Style filters implemented
DISC-006,Customer,Discover Feed,Provider Portfolio Access,View provider portfolio from feed,P0,M,✓,,,,Completed,Navigation to portfolio
DISC-007,Customer,Discover Feed,Direct Booking,Book provider directly from reel,P0,M,✓,,,,Completed,Quick booking flow
DISC-008,Customer,Discover Feed,Like and Comment,Engage with reels,P1,M,,,,"Q3 2026",Planned,Social features backend needed
DISC-009,Customer,Discover Feed,Share Reels,Share trending reels,P0,M,✓,,,,"Q2 2026",In Progress,Share functionality ready
REF-001,Customer,Referral & Wallet,Referral Dashboard,Unique referral code and stats,P0,M,✓,,,,Completed,Complete referral overview
REF-002,Customer,Referral & Wallet,Wallet Screen,Wallet balance and transaction history,P0,M,✓,,,,Completed,Balance display and history
REF-003,Customer,Referral & Wallet,Referral History,Complete referral tracking,P0,M,✓,,,,Completed,Referral list with filters
REF-004,Customer,Referral & Wallet,Redemption Screen,Redeem wallet balance,P0,M,✓,,,,"Q2 2026",In Progress,UI ready payment integration pending
REF-005,Customer,Referral & Wallet,Referral Code Generation,Unique code for each user,P0,S,✓,,,,"Q2 2026",In Progress,Code generation ready backend sync pending
REF-006,Customer,Referral & Wallet,Share Referral Code,Share code via social media,P0,S,✓,,,,Completed,Share functionality
REF-007,Customer,Referral & Wallet,Referral Rewards,₹200 reward per successful referral,P0,M,,,,"Q2 2026",Planned,Backend reward system needed
REF-008,Customer,Referral & Wallet,Transaction History,Complete transaction log,P0,M,✓,,,,"Q2 2026",In Progress,Mock data ready backend sync pending
REF-009,Customer,Referral & Wallet,Redemption Options,Booking discount bank transfer UPI,P0,M,✓,,,,"Q2 2026",In Progress,UI ready payment gateway integration pending
PROF-001,Customer,Profile,Profile Screen,User profile overview with stats,P0,M,✓,,,,Completed,Complete profile view
PROF-002,Customer,Profile,Edit Profile Screen,Edit personal information,P0,M,✓,,,,Completed,Form with validation
PROF-003,Customer,Profile,Saved Venues Screen,Manage saved addresses,P0,M,✓,,,,Completed,Add edit delete venues
PROF-004,Customer,Profile,Payment Methods Screen,Manage saved payment methods,P0,M,✓,,,,"Q2 2026",In Progress,UI ready payment method integration pending
PROF-005,Customer,Profile,Settings Screen,App settings and preferences,P0,M,✓,,,,Completed,Notification preferences
PROF-006,Customer,Profile,Support Screen,Help FAQ and contact support,P0,M,✓,,,,Completed,Help center UI
PROF-007,Customer,Profile,Event Preferences,Save favorite styles and music,P1,M,✓,,,,Completed,Preferences selection
PROF-008,Customer,Profile,Terms & Privacy,Legal documents and policies,P1,S,✓,,,,Completed,Static content display
PROF-009,Customer,Profile,Logout Functionality,Secure logout and session clear,P0,S,✓,,,,Completed,Logout implemented
NOTIF-001,Customer,Notifications,Notifications Screen,View all notifications,P0,M,✓,,,,Completed,Notification list UI
NOTIF-002,Customer,Notifications,Push Notifications,Real-time push notifications,P0,L,,,,"Q2 2026",Planned,FCM integration needed
NOTIF-003,Customer,Notifications,Reel Delivery Alerts,Notify when new reel is ready,P0,M,,,,"Q2 2026",Planned,Backend notification system
NOTIF-004,Customer,Notifications,Booking Confirmations,Booking status updates,P0,M,,,,"Q2 2026",Planned,Backend integration
NOTIF-005,Customer,Notifications,Event Reminders,Pre-event reminders,P1,M,,,,"Q3 2026",Planned,Scheduled notifications
NOTIF-006,Customer,Notifications,Payment Updates,Payment status notifications,P0,M,,,,"Q2 2026",Planned,Payment gateway webhooks
NOTIF-007,Customer,Notifications,Referral Rewards,Notify about referral earnings,P1,M,,,,"Q3 2026",Planned,Backend integration
NOTIF-008,Customer,Notifications,Notification Preferences,Manage notification settings,P0,M,✓,,,,Completed,Settings UI ready
PROV-AUTH-001,Provider,Provider Authentication,Provider Registration,Provider sign-up flow,P0,L,✓,,,"Q2 2026",Completed,UI implemented with form validation
PROV-AUTH-002,Provider,Provider Authentication,Business Profile Setup,Complete business profile creation,P0,L,✓,,,"Q2 2026",Completed,Profile form with image upload ready
PROV-AUTH-003,Provider,Provider Authentication,Portfolio Upload,Upload sample reels and photos,P0,M,✓,,,"Q2 2026",Completed,File upload UI ready backend integration pending
PROV-AUTH-004,Provider,Provider Authentication,Service Areas Configuration,Set serviceable areas,P0,M,✓,,,"Q2 2026",Completed,Service areas UI with city selection ready
PROV-AUTH-005,Provider,Provider Authentication,Verification Process,Provider verification workflow,P0,L,✓,,,"Q2 2026",Completed,Verification screen with checklist ready
PROV-AUTH-006,Provider,Provider Authentication,Document Upload,Upload ID certifications,P0,M,✓,,,"Q2 2026",Completed,Document upload UI ready backend integration pending
PROV-AUTH-007,Provider,Provider Authentication,Availability Calendar,Set available dates,P0,M,✓,,,"Q2 2026",Completed,Calendar UI with weekly schedule ready
PROV-DASH-001,Provider,Provider Dashboard,Provider Dashboard Screen,Today's events and statistics,P0,L,✓,,,,"Q2 2026",Completed,Full dashboard with Calendar and Activity tabs implemented
PROV-DASH-002,Provider,Provider Dashboard,Quick Statistics,Earnings bookings ratings overview,P0,M,✓,,,,"Q2 2026",Completed,Stats cards with mock data ready
PROV-DASH-003,Provider,Provider Dashboard,Upcoming Bookings Calendar,Calendar view of bookings,P0,M,✓,,,,"Q2 2026",Completed,TableCalendar integration with booking markers
PROV-DASH-004,Provider,Provider Dashboard,Recent Activity Feed,Latest activities and updates,P0,M,✓,,,,"Q2 2026",Completed,Activity feed with filters implemented
PROV-DASH-005,Provider,Provider Dashboard,Performance Metrics,Key performance indicators,P1,M,✓,,,,"Q3 2026",Completed,Performance metrics with charts ready
PROV-DASH-006,Provider,Provider Dashboard,Quick Actions,Start Event View Bookings Earnings buttons,P0,S,✓,,,,Completed,Action buttons implemented
PROV-BOOK-001,Provider,Booking Management,Provider Bookings Screen,Manage all bookings with tabs,P0,L,✓,,,,"Q2 2026",Completed,Full bookings screen with status tabs and navigation ready
PROV-BOOK-002,Provider,Booking Management,New Booking Notifications,Alert for new booking requests,P0,M,,,,"Q2 2026",Planned,Push notifications needed
PROV-BOOK-003,Provider,Booking Management,Accept/Decline Bookings,Accept or decline booking requests,P0,M,✓,,,,"Q2 2026",In Progress,UI ready backend action pending
PROV-BOOK-004,Provider,Booking Management,View Booking Details,Complete booking information,P0,M,✓,,,,"Q2 2026",Completed,Detailed booking screen with all information ready
PROV-BOOK-005,Provider,Booking Management,Event Calendar View,Calendar visualization of bookings,P0,M,✓,,,,"Q2 2026",Completed,Full calendar screen with status filters and booking navigation ready
PROV-BOOK-006,Provider,Booking Management,Booking Timeline,Visual timeline of booking stages,P0,M,✓,,,,"Q2 2026",Completed,Timeline screen with all booking stages and progress indicators ready
PROV-BOOK-007,Provider,Booking Management,Customer Contact Information,Access customer details,P0,S,✓,,,,"Q2 2026",Completed,Customer contact screen with quick actions and booking history ready
PROV-BOOK-008,Provider,Booking Management,Navigation to Venue,Get directions to event venue,P0,M,✓,,,,"Q2 2026",Completed,Venue navigation screen with map view and directions ready
PROV-BOOK-009,Provider,Booking Management,Pre-Event Checklist,Checklist before event start,P1,M,✓,,,,"Q3 2026",Completed,Pre-event checklist screen with progress tracking ready
PROV-BOOK-010,Provider,Booking Management,Booking Status Management,Update booking status,P0,M,✓,,,,"Q2 2026",Completed,Status management screen with update interface and history ready
PROV-LIVE-001,Provider,Live Event Mode,Live Event Mode Screen,Start and manage live event coverage,P0,L,✓,,,,"Q2 2026",Completed,Full live event screen with recording timer and upload ready
PROV-LIVE-002,Provider,Live Event Mode,Start Event Coverage,Activate live coverage mode,P0,M,✓,,,,"Q2 2026",Completed,Start button with state management ready
PROV-LIVE-003,Provider,Live Event Mode,Real-Time Footage Upload,Upload clips during event,P0,L,✓,,,,"Q2 2026",Completed,Upload UI ready file upload pending
PROV-LIVE-004,Provider,Live Event Mode,Instant Reel Creation Workflow,Quick reel creation process,P0,L,✓,,,,"Q2 2026",Completed,Workflow UI ready
PROV-LIVE-005,Provider,Live Event Mode,Push Notification to Customer,Notify customer when reel ready,P0,M,,,,"Q2 2026",Planned,FCM integration needed
PROV-LIVE-006,Provider,Live Event Mode,Live Event Timer,Track event duration,P0,S,✓,,,,"Q2 2026",Completed,Timer UI with duration tracking ready
PROV-LIVE-007,Provider,Live Event Mode,Shot Checklist,Checklist of key moments to capture,P0,M,✓,,,,"Q2 2026",Completed,Shot checklist with progress tracking ready
PROV-LIVE-008,Provider,Live Event Mode,Customer Milestone Notifications,Notify customer of milestones,P1,M,,,,"Q3 2026",Planned,Notification system needed
PROV-LIVE-009,Provider,Live Event Mode,Coverage Progress Tracking,Track coverage completion,P0,M,✓,,,,"Q2 2026",Completed,Progress tracking with visual indicators ready
PROV-EDIT-001,Provider,Reel Editor,Reel Editor Screen,Mobile editing interface,P0,L,✓,,,,"Q2 2026",Completed,Full editor screen with tools and delivery queue ready
PROV-EDIT-002,Provider,Reel Editor,Quick Edit Tools,Trim filters transitions music tools,P0,L,✓,,,,"Q2 2026",Completed,Edit tools UI ready native editing pending
PROV-EDIT-003,Provider,Reel Editor,AI-Assisted Editing Suggestions,AI-powered editing recommendations,P1,L,,,,"Q3 2026",Planned,AI integration needed
PROV-EDIT-004,Provider,Reel Editor,Reel Preview,Preview before delivery,P0,M,✓,,,,"Q2 2026",Completed,Preview UI ready
PROV-EDIT-005,Provider,Reel Editor,Batch Reel Creation,Create multiple reels simultaneously,P1,M,,,,"Q3 2026",Planned,Batch processing needed
PROV-EDIT-006,Provider,Reel Editor,Delivery Queue Management,Manage pending and delivered reels,P0,M,✓,,,,"Q2 2026",Completed,Delivery queue with status management ready
PROV-EDIT-007,Provider,Reel Editor,Quality Control Check,Quality assessment before delivery,P0,M,✓,,,,"Q2 2026",Completed,Quality control checklist ready
PROV-EDIT-008,Provider,Reel Editor,Template Library,Pre-made editing templates,P1,M,,,,"Q3 2026",Planned,Template system needed
PROV-EDIT-009,Provider,Reel Editor,Music Library Integration,Licensed music library,P1,M,,,,"Q3 2026",Planned,Music API integration
PROV-EARN-001,Provider,Provider Earnings,Provider Earnings Screen,Earnings dashboard and analytics,P0,L,✓,,,,"Q2 2026",Completed,Full earnings screen with Payments and Analytics tabs ready
PROV-EARN-002,Provider,Provider Earnings,Earnings Dashboard,Complete earnings overview,P0,M,✓,,,,"Q2 2026",Completed,Dashboard with stats and quick actions ready
PROV-EARN-003,Provider,Provider Earnings,Payment History,Historical payment records,P0,M,✓,,,,"Q2 2026",Completed,Payment history with filters ready
PROV-EARN-004,Provider,Provider Earnings,Pending Payments,View pending payment amounts,P0,M,✓,,,,"Q2 2026",Completed,Pending payments section ready
PROV-EARN-005,Provider,Provider Earnings,Commission Breakdown,Detailed commission structure,P0,M,✓,,,,"Q2 2026",Completed,Commission breakdown UI ready
PROV-EARN-006,Provider,Provider Earnings,Payout Requests,Request payment withdrawal,P0,M,✓,,,,"Q2 2026",Completed,Payout request form ready
PROV-EARN-007,Provider,Provider Earnings,Tax Documentation,Generate tax documents,P1,M,,,,"Q3 2026",Planned,Document generation needed
PROV-EARN-008,Provider,Provider Earnings,Performance Metrics,Provider performance analytics,P1,M,✓,,,,"Q3 2026",Completed,Performance metrics with charts ready
PROV-EARN-009,Provider,Provider Earnings,Earnings Trends,Visualize earnings over time,P1,M,✓,,,,"Q3 2026",Completed,Earnings trends chart ready
PROV-UPLOAD-001,Provider,Upload Footage,Upload Footage Screen,Upload event footage interface,P0,M,✓,,,,"Q2 2026",Completed,Full upload screen with multiple file support ready
PROV-UPLOAD-002,Provider,Upload Footage,Video File Selection,Select videos from device,P0,M,✓,,,,"Q2 2026",Completed,File picker with multiple selection ready
PROV-UPLOAD-003,Provider,Upload Footage,Video Compression,Compress videos before upload,P0,M,,,,"Q2 2026",Planned,Compression library needed
PROV-UPLOAD-004,Provider,Upload Footage,Upload Progress,Track upload progress,P0,M,✓,,,,"Q2 2026",Completed,Progress indicator with percentage ready
PROV-UPLOAD-005,Provider,Upload Footage,Multiple File Upload,Upload multiple files simultaneously,P1,M,✓,,,,"Q3 2026",Completed,Multiple file upload with queue ready
PROV-UPLOAD-006,Provider,Upload Footage,Upload Queue,Manage upload queue,P1,M,✓,,,,"Q3 2026",Completed,Upload queue management ready
PROV-UPLOAD-007,Provider,Upload Footage,Retry Failed Uploads,Retry mechanism for failed uploads,P1,M,✓,,,,"Q3 2026",Completed,Retry mechanism UI ready
ADMIN-001,Admin,Admin Dashboard,Admin Dashboard,Platform administration dashboard,P1,L,✓,,,,"Q4 2026",Completed,Full admin dashboard with stats and quick actions ready
ADMIN-002,Admin,Admin Dashboard,User Management,Manage customers and providers,P1,L,✓,,,,"Q4 2026",Completed,User management screen with filters and actions ready
ADMIN-003,Admin,Admin Dashboard,Booking Management,Oversee all bookings,P1,L,✓,,,,"Q4 2026",Completed,Booking management with status filters ready
ADMIN-004,Admin,Admin Dashboard,Provider Verification,Verify provider accounts,P1,M,✓,,,,"Q4 2026",Completed,Provider verification screen with review actions ready
ADMIN-005,Admin,Admin Dashboard,Content Moderation,Moderate reels and content,P1,L,✓,,,,"Q4 2026",Completed,Content moderation screen with approve/reject actions ready
ADMIN-006,Admin,Admin Dashboard,Analytics Dashboard,Platform-wide analytics,P1,L,✓,,,,"Q4 2026",Completed,Analytics dashboard with charts and metrics ready
ADMIN-007,Admin,Admin Dashboard,Payment Management,Manage payments and payouts,P1,L,✓,,,,"Q4 2026",Completed,Payment management with transaction filters ready
ADMIN-008,Admin,Admin Dashboard,Support Tickets,Handle customer support tickets,P1,M,✓,,,,"Q4 2026",Completed,Support tickets screen with status management ready

